{
  "budgetCalibration": {
    "coldInstanceRetainedCapacity": {
      "appliesTo": {
        "accuracyProfileCodes": [
          1,
          2,
          3
        ],
        "directionProfileCodes": [
          1,
          2,
          3
        ],
        "workloadIds": [
          "LF-COMP-GEOMETRY-MIN-v1",
          "LF-COMP-GEOMETRY-CORRIDOR-v1",
          "LF-COMP-GEOMETRY-P100-v1"
        ]
      },
      "budgetSource": "#296 G1 候选预算（docs/design/geometry-document-frontend.md §9.2）",
      "calibratedBudget": 0,
      "candidateBudget": 0,
      "observedValue": 0,
      "statistic": "perRowExactMax",
      "supported": true,
      "unit": "bytes"
    },
    "compilerControlledPeak": {
      "appliesTo": {
        "accuracyProfileCodes": [
          1,
          2,
          3
        ],
        "directionProfileCodes": [
          1,
          2,
          3
        ],
        "workloadIds": [
          "LF-COMP-GEOMETRY-MIN-v1",
          "LF-COMP-GEOMETRY-CORRIDOR-v1",
          "LF-COMP-GEOMETRY-P100-v1"
        ]
      },
      "budgetSource": "#296 G1 候选预算（docs/design/geometry-document-frontend.md §9.2）",
      "calibratedBudget": 6291456,
      "candidateBudget": 6291456,
      "observedValue": 3628485,
      "statistic": "perRowExactMax",
      "supported": true,
      "unit": "bytes"
    },
    "fullCompileWallClock": {
      "appliesTo": {
        "accuracyProfileCodes": [
          1,
          2,
          3
        ],
        "directionProfileCodes": [
          1,
          2,
          3
        ],
        "workloadIds": [
          "LF-COMP-GEOMETRY-MIN-v1",
          "LF-COMP-GEOMETRY-CORRIDOR-v1",
          "LF-COMP-GEOMETRY-P100-v1"
        ]
      },
      "budgetSource": "#296 G1 候选预算（docs/design/geometry-document-frontend.md §9.2）",
      "calibratedBudget": 25000000,
      "candidateBudget": 25000000,
      "observedValue": 11924500,
      "statistic": "perRowMedianOfMediansMax",
      "supported": true,
      "unit": "ns"
    }
  },
  "environment": {
    "biosFirmware": "N.1.09MRO07 (2025-04-08)",
    "cpu": "AMD Ryzen 9 9955HX 16-Core Processor",
    "hardwareId": "LF-P100-REF-01",
    "hardwareIdentityScheme": "laneflow-p100-hardware-identity-v1",
    "hardwareIdentitySha256": "be3637be955f6c2c9e9e55b80419794adfac64b709d573602a37da9a8672fd20",
    "llvm": "22.1.2",
    "logicalProcessorCount": 32,
    "operatingSystem": "Microsoft Windows 11 专业版 Insider Preview",
    "operatingSystemBuild": "29639",
    "physicalCoreCount": 16,
    "physicalMemoryBytes": 66232508416,
    "powerPlan": "平衡",
    "powerSource": "交流电",
    "rustc": "1.96.0 (ac68faa20 2026-05-25)",
    "sleepOrSessionLockObserved": false,
    "targetTriple": "x86_64-pc-windows-msvc",
    "thermalOrPowerThrottlingObserved": false
  },
  "protocol": {
    "clockQuantumNs": 100,
    "formalSampleCountPerLevel": 7,
    "id": "geometry-frontend-calibration-v1",
    "levels": [
      "geometryParseBuild",
      "geometryNumericFreeze",
      "commonAdmission",
      "fullCompile"
    ],
    "processCount": 3,
    "releaseBuild": true,
    "singleWorkerThread": true,
    "warmupCountPerLevel": 1
  },
  "rawExecution": {
    "byteLength": 168288,
    "path": "docs/reference/geometry-frontend-calibration-raw-execution-v1.json",
    "schema": "laneflow.geometry-frontend-calibration-raw-execution",
    "schemaVersion": 1,
    "sha256": "adc22f462cb03052f09972ffc7bb2180e0149dc4a9c217fb373b8762a6c7e6c1"
  },
  "rows": [
    {
      "accuracyProfileCode": 1,
      "compilerControlledPeakBytes": 11796,
      "compilerRetainedCapacityBytes": 0,
      "completeOutputDigest": "e8b7cfd1e23e1588dea8a6fc9c83178527cb207497c8cd55b0fe42f66b6aa533",
      "directionProfileCode": 1,
      "levels": {
        "commonAdmission": {
          "medianOfMediansNs": 1000,
          "perProcess": [
            {
              "madNs": 100,
              "medianNs": 1000
            },
            {
              "madNs": 0,
              "medianNs": 900
            },
            {
              "madNs": 200,
              "medianNs": 1100
            }
          ]
        },
        "fullCompile": {
          "medianOfMediansNs": 35600,
          "perProcess": [
            {
              "madNs": 2300,
              "medianNs": 37600
            },
            {
              "madNs": 700,
              "medianNs": 34600
            },
            {
              "madNs": 500,
              "medianNs": 35600
            }
          ]
        },
        "geometryNumericFreeze": {
          "medianOfMediansNs": 7800,
          "perProcess": [
            {
              "madNs": 400,
              "medianNs": 7700
            },
            {
              "madNs": 500,
              "medianNs": 7800
            },
            {
              "madNs": 300,
              "medianNs": 7800
            }
          ]
        },
        "geometryParseBuild": {
          "medianOfMediansNs": 7800,
          "perProcess": [
            {
              "madNs": 400,
              "medianNs": 7800
            },
            {
              "madNs": 200,
              "medianNs": 7800
            },
            {
              "madNs": 200,
              "medianNs": 7700
            }
          ]
        }
      },
      "semanticFingerprint": "5937730a75b5a170f61d82e2a77e6693256ed52a76d99d47dda835cd79783478",
      "workloadId": "LF-COMP-GEOMETRY-MIN-v1"
    },
    {
      "accuracyProfileCode": 1,
      "compilerControlledPeakBytes": 11796,
      "compilerRetainedCapacityBytes": 0,
      "completeOutputDigest": "e8b7cfd1e23e1588dea8a6fc9c83178527cb207497c8cd55b0fe42f66b6aa533",
      "directionProfileCode": 2,
      "levels": {
        "commonAdmission": {
          "medianOfMediansNs": 900,
          "perProcess": [
            {
              "madNs": 100,
              "medianNs": 1300
            },
            {
              "madNs": 100,
              "medianNs": 900
            },
            {
              "madNs": 100,
              "medianNs": 900
            }
          ]
        },
        "fullCompile": {
          "medianOfMediansNs": 33800,
          "perProcess": [
            {
              "madNs": 300,
              "medianNs": 32700
            },
            {
              "madNs": 700,
              "medianNs": 33800
            },
            {
              "madNs": 600,
              "medianNs": 34000
            }
          ]
        },
        "geometryNumericFreeze": {
          "medianOfMediansNs": 7100,
          "perProcess": [
            {
              "madNs": 200,
              "medianNs": 6400
            },
            {
              "madNs": 100,
              "medianNs": 7100
            },
            {
              "madNs": 400,
              "medianNs": 7300
            }
          ]
        },
        "geometryParseBuild": {
          "medianOfMediansNs": 7700,
          "perProcess": [
            {
              "madNs": 200,
              "medianNs": 7700
            },
            {
              "madNs": 100,
              "medianNs": 7700
            },
            {
              "madNs": 100,
              "medianNs": 7800
            }
          ]
        }
      },
      "semanticFingerprint": "5937730a75b5a170f61d82e2a77e6693256ed52a76d99d47dda835cd79783478",
      "workloadId": "LF-COMP-GEOMETRY-MIN-v1"
    },
    {
      "accuracyProfileCode": 1,
      "compilerControlledPeakBytes": 11796,
      "compilerRetainedCapacityBytes": 0,
      "completeOutputDigest": "e8b7cfd1e23e1588dea8a6fc9c83178527cb207497c8cd55b0fe42f66b6aa533",
      "directionProfileCode": 3,
      "levels": {
        "commonAdmission": {
          "medianOfMediansNs": 900,
          "perProcess": [
            {
              "madNs": 0,
              "medianNs": 900
            },
            {
              "madNs": 0,
              "medianNs": 900
            },
            {
              "madNs": 0,
              "medianNs": 900
            }
          ]
        },
        "fullCompile": {
          "medianOfMediansNs": 32800,
          "perProcess": [
            {
              "madNs": 800,
              "medianNs": 32800
            },
            {
              "madNs": 300,
              "medianNs": 33100
            },
            {
              "madNs": 300,
              "medianNs": 32100
            }
          ]
        },
        "geometryNumericFreeze": {
          "medianOfMediansNs": 6400,
          "perProcess": [
            {
              "madNs": 100,
              "medianNs": 6400
            },
            {
              "madNs": 0,
              "medianNs": 6600
            },
            {
              "madNs": 0,
              "medianNs": 6400
            }
          ]
        },
        "geometryParseBuild": {
          "medianOfMediansNs": 7200,
          "perProcess": [
            {
              "madNs": 0,
              "medianNs": 7200
            },
            {
              "madNs": 0,
              "medianNs": 7200
            },
            {
              "madNs": 200,
              "medianNs": 7400
            }
          ]
        }
      },
      "semanticFingerprint": "5937730a75b5a170f61d82e2a77e6693256ed52a76d99d47dda835cd79783478",
      "workloadId": "LF-COMP-GEOMETRY-MIN-v1"
    },
    {
      "accuracyProfileCode": 2,
      "compilerControlledPeakBytes": 11796,
      "compilerRetainedCapacityBytes": 0,
      "completeOutputDigest": "e8b7cfd1e23e1588dea8a6fc9c83178527cb207497c8cd55b0fe42f66b6aa533",
      "directionProfileCode": 1,
      "levels": {
        "commonAdmission": {
          "medianOfMediansNs": 900,
          "perProcess": [
            {
              "madNs": 0,
              "medianNs": 900
            },
            {
              "madNs": 0,
              "medianNs": 900
            },
            {
              "madNs": 0,
              "medianNs": 900
            }
          ]
        },
        "fullCompile": {